id,name,source_basis,front_end,vas,output,feedback_note,vin_1w_peak_mv,actual_1w_vrms,thd_1w_pct,vin_5w_peak_mv,actual_5w_vrms,thd_5w_pct,vin_8w_peak_mv,actual_8w_vrms,thd_8w_pct,clean_power_1pct_w,damping_factor_8r,headroom_v_peak,bandwidth_khz_est,rise_time_us_est,overshoot_pct_est,offset_mv_est,thermal_drift_mv_c_est,idle_ma_est,phase_margin_deg_est,complexity_1_10,no_global_alignment,radio_source_score,notes,project_score,unrestricted_score
04,Complementary folded cascode with CFP/Sziklai output,Grechishkin-style BJT front end plus Syrico bias discipline and Rogov output-stage tradeoffs,"Matched BJT differential pair, tail current source, mirror load",Complementary folded-cascode BJT VAS with emitter degeneration,Complementary feedback pair/Sziklai output with emitter ballast,No overall feedback; CFP is local output-stage feedback,403.81,2.8284,0.1144,901.54,6.3246,0.0554,1140.11,8.0,0.0464,9.0,145.5,12.2,135.0,2.593,7.3,9.0,0.3,72.0,55.0,9,1.0,0.88,"Best no-overall-feedback balance in this study: high headroom, strong local output linearity, and manageable idle current.",88.98,79.9
05,Discrete current-feedback BJT power amplifier,"Petrov 2018 current-feedback UMZCH article, implemented as a pure BJT loop",Low-impedance BJT transimpedance input stage,Wideband complementary BJT gain stage with current feedback summing,Two-stage complementary emitter follower with output-current sensing,Global current feedback from output/sense resistor to input summing node,402.54,2.8284,0.0861,899.05,6.3246,0.0418,1142.13,8.0,0.6234,8.0,228.6,11.5,300.0,1.167,12.04,10.0,0.4,82.0,48.0,10,0.55,0.95,Measurement-first option if global current feedback is allowed; less aligned with the no-overall-feedback target.,84.67,85.26
02,Rogov-style triple emitter follower output,Rogov 2018 two-vs-three follower discussion; Grechishkin 2013 BJT signal path,BJT long-tailed pair with current-source tail and mirror load,BJT VAS buffered by a pre-driver stage,"Three-stage complementary emitter follower, Class AB",No overall feedback; local emitter degeneration and ballast resistors,404.72,2.8284,0.1617,902.86,6.3246,0.089,1270.89,8.0,8.6909,6.0,123.1,10.1,130.0,2.692,4.36,15.0,0.5,76.0,62.0,8,1.0,0.9,"Lower driver stress and output impedance, but the extra Vbe drops are expensive on +/-15 V rails.",78.29,66.63
03,"Low-voltage folded cascode VAS, double emitter follower",Radio.ru BJT/current-source/mirror practices adapted for low-rail headroom,Degenerated BJT differential pair with current mirror load,Folded-cascode BJT VAS with current-source loads,"Two-stage complementary emitter follower, Class AB",No overall feedback; local VAS/output degeneration only,407.02,2.8284,0.216,907.46,6.3246,0.1034,1149.7,8.0,0.309,8.0,80.0,11.7,160.0,2.188,2.68,12.0,0.35,66.0,66.0,8,1.0,0.84,A better low-voltage open-loop candidate: folded VAS preserves swing while staying more predictable than CFP.,76.12,63.06
01,"Classic BJT differential amp, double emitter follower",Grechishkin 2013 BJT power amp pattern; Syrico 2017 bias/driver ideas,"BJT long-tailed pair, current mirror load, RF input filter",Single-ended BJT VAS with current-source load and emitter degeneration,Two-stage complementary emitter follower with 0.22 ohm ballast resistors,No overall feedback; local emitter degeneration only,409.75,2.8284,0.2953,912.5,6.3246,0.1491,1170.42,8.0,1.7379,7.0,57.1,11.1,110.0,3.182,1.0,18.0,0.45,58.0,72.0,6,1.0,0.92,"The conservative baseline: easy to bias and debug, but VAS/output linearity must do more work without global feedback.",71.63,56.13
